{"schemaVersion":"1.0","sessionId":"budget-session","taskContractId":"budget-task","records":[{"sessionId":"budget-session","invocationId":"invoke-1","sequence":0,"tokensTotal":100,"producerType":"harness","producerName":"meter","producerVersion":"1.0","evidenceBasis":"harness-metered"},{"sessionId":"budget-session","invocationId":"invoke-2","sequence":1,"tokensTotal":50,"producerType":"adapter","producerName":"usage-adapter","producerVersion":null,"evidenceBasis":"provider-usage-field"}]}
